{
  "$schema":"https://json-schema.org/draft/2020-12/schema","type":"object","additionalProperties":false,
  "required":["verdict","proposition_checks","speech_act_equivalent","added_meaning","summary"],
  "properties":{
    "verdict":{"type":"string","enum":["equivalent","not_equivalent","uncertain"]},
    "proposition_checks":{"type":"array","minItems":4,"maxItems":4,"items":{"type":"object","additionalProperties":false,"required":["proposition_id","status","evidence"],"properties":{"proposition_id":{"type":"string"},"status":{"type":"string","enum":["preserved","omitted","altered","uncertain"]},"evidence":{"type":"string","minLength":1}}}},
    "speech_act_equivalent":{"type":"boolean"},"added_meaning":{"type":"array","items":{"type":"string","minLength":1}},"summary":{"type":"string","minLength":1}
  }
}
