{"verdict":"equivalent","proposition_checks":[{"proposition_id":"alias-change","status":"preserved","evidence":"The rendering states that the migration \"renamed three public fields while retaining compatibility aliases.\""},{"proposition_id":"alias-evidence","status":"preserved","evidence":"The rendering states that \"Twelve of fourteen known clients have migrated, while the status of the other two is unknown.\""},{"proposition_id":"alias-limit","status":"preserved","evidence":"The rendering states that integration tests cover the twelve migrated clients, but not the two clients whose status is unknown."},{"proposition_id":"alias-decision","status":"preserved","evidence":"The rendering directs: \"Do not remove the aliases until the owners of the two remaining clients confirm migration.\""}],"speech_act_equivalent":true,"added_meaning":[],"summary":"All four required propositions are preserved. The rendering gives the required bounded rejection recommendation, identifies the test-coverage limitation, and states owner confirmation as the prerequisite for removal, without adding substantive meaning."}