{"verdict":"not_equivalent","proposition_checks":[{"proposition_id":"alias-change","status":"preserved","evidence":"“The migration renamed three public fields while retaining those aliases.”"},{"proposition_id":"alias-evidence","status":"preserved","evidence":"“Twelve of fourteen known clients have migrated, while the status of two remains unknown.”"},{"proposition_id":"alias-limit","status":"preserved","evidence":"“Integration coverage includes the twelve migrated clients, not the two of unknown status.”"},{"proposition_id":"alias-decision","status":"preserved","evidence":"“Do not remove the aliases until both remaining client owners confirm migration.”"}],"speech_act_equivalent":true,"added_meaning":["The rendering asserts that the tests are “not broadly inadequate,” a broader judgment about test adequacy not established by the brief.","The rendering characterizes client migration as “nearly complete,” an evaluative framing beyond the exact migration counts."],"summary":"All four required propositions and the bounded rejection speech act are preserved, including the evidence limitation and prerequisite. However, the rendering adds broader evaluative claims about overall test adequacy and migration completeness, so it is not semantically equivalent under the contract."}