{"verdict":"equivalent","proposition_checks":[{"proposition_id":"cache-change","status":"preserved","evidence":"“extends the cache lifetime from five minutes to fifteen minutes”"},{"proposition_id":"cache-evidence","status":"preserved","evidence":"“A twenty-four-hour benchmark observed eighteen percent fewer origin requests.”"},{"proposition_id":"cache-limit","status":"preserved","evidence":"“the benchmark did not measure stale-read incidence”"},{"proposition_id":"cache-decision","status":"preserved","evidence":"“Approve only a canary deployment, and require stale-read telemetry before any broader rollout.”"}],"speech_act_equivalent":true,"added_meaning":[],"summary":"All four required propositions are preserved. The rendering makes the bounded canary approval, evidence limitation, and telemetry prerequisite explicit without adding independent meaning."}