{"verdict":"not_equivalent","proposition_checks":[{"proposition_id":"cache-change","status":"preserved","evidence":"“The proposed update changes the cache lifetime from five minutes to fifteen minutes.”"},{"proposition_id":"cache-evidence","status":"preserved","evidence":"“A twenty-four-hour benchmark observed eighteen percent fewer origin requests.”"},{"proposition_id":"cache-limit","status":"preserved","evidence":"“The benchmark did not measure stale-read incidence.”"},{"proposition_id":"cache-decision","status":"preserved","evidence":"“Approve only a canary deployment, and require stale-read telemetry before broader rollout.”"}],"speech_act_equivalent":true,"added_meaning":["The rendering adds the evaluative claim that its framing makes the practical consequence “appropriately narrow.”"],"summary":"All four required propositions and the bounded approval speech act are preserved, but the added evaluative assertion about appropriate narrowness prevents strict semantic equivalence."}