{"verdict":"equivalent","proposition_checks":[{"proposition_id":"cache-change","status":"preserved","evidence":"“changes the cache lifetime from five minutes to fifteen minutes”"},{"proposition_id":"cache-evidence","status":"preserved","evidence":"“A benchmark conducted over twenty-four hours observed eighteen percent fewer origin requests.”"},{"proposition_id":"cache-limit","status":"preserved","evidence":"“the benchmark did not measure stale-read incidence”"},{"proposition_id":"cache-decision","status":"preserved","evidence":"“approve only a canary deployment and require stale-read telemetry before any broader rollout”"}],"speech_act_equivalent":true,"added_meaning":[],"summary":"All four required propositions are preserved. The rendering makes the bounded approval recommendation, explicitly identifies the evidence limitation, and retains stale-read telemetry as a prerequisite to broader rollout without adding meaning."}