{"verdict":"equivalent","proposition_checks":[{"proposition_id":"alias-change","status":"preserved","evidence":"“The migration renamed three public fields while retaining compatibility aliases.”"},{"proposition_id":"alias-evidence","status":"preserved","evidence":"“Twelve of fourteen known clients have migrated; the status of two remains unknown.”"},{"proposition_id":"alias-limit","status":"preserved","evidence":"“Integration tests cover the twelve migrated clients, not the other two.”"},{"proposition_id":"alias-decision","status":"preserved","evidence":"“Do not remove the aliases until both remaining client owners confirm migration.”"}],"speech_act_equivalent":true,"added_meaning":[],"summary":"All four required propositions are preserved exactly in substance. The rendering makes the required bounded rejection recommendation, explicitly identifies the evidence limitation, and states confirmation by the two remaining client owners as the prerequisite for alias removal."}